{
  "metadata": {
    "episodeId": "episodio-17-el-correo-infinito",
    "language": "es-MX",
    "seed": 1724511258,
    "status": "draft",
    "title": "Episodio 17 · El correo infinito"
  },
  "scenes": [
    {
      "beats": [
        {
          "characterId": "pato",
          "durationMs": {
            "confidence": 0.9,
            "inferred": true,
            "value": 4000
          },
          "emotion": {
            "confidence": 0.4,
            "inferred": true,
            "value": "seriedad"
          },
          "id": "beat-0001",
          "sourceEndLine": 2,
          "sourceFragment": "No nos vamos a ir hasta que Persona_3 termine sus pendientes (ES)",
          "sourceStartLine": 2,
          "speaker": "Persona_1",
          "speakerInference": {
            "confidence": 1.0,
            "inferred": false
          },
          "stageDirection": {
            "confidence": 0.85,
            "inferred": true,
            "value": "Revisa su reloj"
          },
          "verbatimText": "No nos vamos a ir hasta que Persona_3 termine sus pendientes"
        },
        {
          "characterId": "conejo",
          "durationMs": {
            "confidence": 0.9,
            "inferred": true,
            "value": 3000
          },
          "emotion": {
            "confidence": 0.4,
            "inferred": true,
            "value": "seriedad"
          },
          "id": "beat-0002",
          "sourceEndLine": 5,
          "sourceFragment": "Pero ya acabé mis pendientes (PP Persona_3)",
          "sourceStartLine": 5,
          "speaker": "Persona_3",
          "speakerInference": {
            "confidence": 1.0,
            "inferred": false
          },
          "stageDirection": {
            "confidence": 0.85,
            "inferred": true,
            "value": "Levanta la mano"
          },
          "verbatimText": "Pero ya acabé mis pendientes"
        },
        {
          "characterId": "pato",
          "durationMs": {
            "confidence": 0.9,
            "inferred": true,
            "value": 3000
          },
          "emotion": {
            "confidence": 0.8,
            "inferred": true,
            "value": "felicidad"
          },
          "id": "beat-0003",
          "sourceEndLine": 8,
          "sourceFragment": "Entonces vámonos (PP Persona_1)",
          "sourceStartLine": 8,
          "speaker": "Persona_1",
          "speakerInference": {
            "confidence": 1.0,
            "inferred": false
          },
          "stageDirection": {
            "confidence": 0.85,
            "inferred": true,
            "value": "Se inclina hacia adelante"
          },
          "verbatimText": "Entonces vámonos"
        },
        {
          "characterId": "conejo",
          "durationMs": {
            "confidence": 0.9,
            "inferred": true,
            "value": 4000
          },
          "emotion": {
            "confidence": 0.8,
            "inferred": true,
            "value": "confusión"
          },
          "id": "beat-0004",
          "sourceEndLine": 11,
          "sourceFragment": "Esperen, ya solo me falta escribirle un correo a los de Sistemas (PA-I*1.2)",
          "sourceStartLine": 11,
          "speaker": "Persona_3",
          "speakerInference": {
            "confidence": 1.0,
            "inferred": false
          },
          "stageDirection": {
            "confidence": 0.85,
            "inferred": true,
            "value": "Mira la pantalla de su computadora"
          },
          "verbatimText": "Esperen, ya solo me falta escribirle un correo a los de Sistemas"
        },
        {
          "characterId": "pato",
          "durationMs": {
            "confidence": 0.9,
            "inferred": true,
            "value": 2000
          },
          "emotion": {
            "confidence": 0.4,
            "inferred": true,
            "value": "seriedad"
          },
          "id": "beat-0005",
          "sourceEndLine": 14,
          "sourceFragment": "Noooo… (PP Persona_1)",
          "sourceStartLine": 14,
          "speaker": "Persona_1",
          "speakerInference": {
            "confidence": 1.0,
            "inferred": false
          },
          "stageDirection": {
            "confidence": 0.85,
            "inferred": true,
            "value": "Horror"
          },
          "verbatimText": "Noooo…"
        },
        {
          "characterId": "pato",
          "durationMs": {
            "confidence": 0.9,
            "inferred": true,
            "value": 2000
          },
          "emotion": {
            "confidence": 0.4,
            "inferred": true,
            "value": "seriedad"
          },
          "id": "beat-0006",
          "sourceEndLine": 15,
          "sourceFragment": "OSD (Dum!) (ZO*1.5)",
          "sourceStartLine": 15,
          "speaker": "Persona_1",
          "speakerInference": {
            "confidence": 1.0,
            "inferred": false
          },
          "stageDirection": {
            "confidence": 0.85,
            "inferred": true,
            "value": "Horror"
          },
          "verbatimText": "OSD (Dum!)"
        },
        {
          "characterId": "conejo",
          "durationMs": {
            "confidence": 0.9,
            "inferred": true,
            "value": 1500
          },
          "emotion": {
            "confidence": 0.4,
            "inferred": true,
            "value": "seriedad"
          },
          "id": "beat-0007",
          "sourceEndLine": 18,
          "sourceFragment": "Es rápido, es solo un correo (PP Persona_3)",
          "sourceStartLine": 18,
          "speaker": "Persona_3",
          "speakerInference": {
            "confidence": 1.0,
            "inferred": false
          },
          "stageDirection": {
            "confidence": 0.85,
            "inferred": true,
            "value": "Teclado en mano"
          },
          "verbatimText": "Es rápido, es solo un correo"
        },
        {
          "characterId": "conejo",
          "durationMs": {
            "confidence": 0.9,
            "inferred": true,
            "value": 1500
          },
          "emotion": {
            "confidence": 0.4,
            "inferred": true,
            "value": "seriedad"
          },
          "id": "beat-0008",
          "sourceEndLine": 19,
          "sourceFragment": "OSD (Prrrrt) (PA-D*1.2)",
          "sourceStartLine": 19,
          "speaker": "Persona_3",
          "speakerInference": {
            "confidence": 1.0,
            "inferred": false
          },
          "stageDirection": {
            "confidence": 0.85,
            "inferred": true,
            "value": "Teclado en mano"
          },
          "verbatimText": "OSD (Prrrrt)"
        },
        {
          "characterId": "pato",
          "durationMs": {
            "confidence": 0.9,
            "inferred": true,
            "value": 3000
          },
          "emotion": {
            "confidence": 0.4,
            "inferred": true,
            "value": "seriedad"
          },
          "id": "beat-0009",
          "sourceEndLine": 22,
          "sourceFragment": "¿Seguro? (PP Persona_1)",
          "sourceStartLine": 22,
          "speaker": "Persona_1",
          "speakerInference": {
            "confidence": 1.0,
            "inferred": false
          },
          "stageDirection": {
            "confidence": 0.85,
            "inferred": true,
            "value": "Entrecierra los ojos"
          },
          "verbatimText": "¿Seguro?"
        },
        {
          "characterId": "conejo",
          "durationMs": {
            "confidence": 0.9,
            "inferred": true,
            "value": 3000
          },
          "emotion": {
            "confidence": 0.4,
            "inferred": true,
            "value": "seriedad"
          },
          "id": "beat-0010",
          "sourceEndLine": 25,
          "sourceFragment": "Sí, sí… (PA-D*1.2)",
          "sourceStartLine": 25,
          "speaker": "Persona_3",
          "speakerInference": {
            "confidence": 1.0,
            "inferred": false
          },
          "stageDirection": {
            "confidence": 0.85,
            "inferred": true,
            "value": "Empieza a escribir"
          },
          "verbatimText": "Sí, sí…"
        }
      ],
      "id": "scene-001",
      "placeId": "sala",
      "placeInference": {
        "confidence": 1.0,
        "inferred": false
      },
      "placeLabel": "SALA"
    },
    {
      "beats": [
        {
          "characterId": "conejo",
          "durationMs": {
            "confidence": 0.9,
            "inferred": true,
            "value": 3000
          },
          "emotion": {
            "confidence": 0.4,
            "inferred": true,
            "value": "seriedad"
          },
          "id": "beat-0011",
          "sourceEndLine": 32,
          "sourceFragment": "Listo, ya terminé (PP Persona_3)",
          "sourceStartLine": 32,
          "speaker": "Persona_3",
          "speakerInference": {
            "confidence": 1.0,
            "inferred": false
          },
          "stageDirection": {
            "confidence": 0.85,
            "inferred": true,
            "value": "Se estira"
          },
          "verbatimText": "Listo, ya terminé"
        },
        {
          "characterId": "pata",
          "durationMs": {
            "confidence": 0.9,
            "inferred": true,
            "value": 1500
          },
          "emotion": {
            "confidence": 0.4,
            "inferred": true,
            "value": "seriedad"
          },
          "id": "beat-0012",
          "sourceEndLine": 35,
          "sourceFragment": "¡Por fin! (PP Persona_4)",
          "sourceStartLine": 35,
          "speaker": "Persona_4",
          "speakerInference": {
            "confidence": 1.0,
            "inferred": false
          },
          "stageDirection": {
            "confidence": 0.85,
            "inferred": true,